[{"bt_run_id":"nfl_games_v1:7244a0bc8ac6","split":"tune","phase":"pooled","candidate":"C0","n":1365,"brier":0.2111163804,"logloss":0.6096812419,"accuracy":0.6527472527,"ece":0.0309627029,"slope":1.0470224206,"slope_lo":0.894073235,"slope_hi":1.1999716061,"skill":0,"skill_lo":0,"skill_hi":0},{"bt_run_id":"nfl_games_v1:7244a0bc8ac6","split":"tune","phase":"pooled","candidate":"C1","n":1365,"brier":0.2223584395,"logloss":0.6357883774,"accuracy":0.6322344322,"ece":0.0248199607,"slope":1.0178430771,"slope_lo":0.8400298539,"slope_hi":1.1956563002,"skill":-0.0532505298,"skill_lo":-0.0756990948,"skill_hi":-0.0317356192,"dm_p_better_bh":0.9999969419},{"bt_run_id":"nfl_games_v1:7244a0bc8ac6","split":"tune","phase":"pooled","candidate":"C2","n":1365,"brier":0.2196459895,"logloss":0.6288745404,"accuracy":0.6468864469,"ece":0.0448777089,"slope":1.0639369438,"slope_lo":0.8899475403,"slope_hi":1.2379263474,"skill":-0.0404024033,"skill_lo":-0.0605071636,"skill_hi":-0.020603701,"dm_p_better_bh":0.9999969419},{"bt_run_id":"nfl_games_v1:7244a0bc8ac6","split":"tune","phase":"pooled","candidate":"E1","n":1365,"brier":0.2195350529,"logloss":0.6290732411,"accuracy":0.6417582418,"ece":0.0430162482,"slope":1.1010690123,"slope_lo":0.9194030549,"slope_hi":1.2827349696,"skill":-0.0398769275,"skill_lo":-0.0593907267,"skill_hi":-0.0212774449,"dm_p_better_bh":0.9999969419},{"bt_run_id":"nfl_games_v1:7244a0bc8ac6","split":"tune","phase":"pooled","candidate":"B1[C1]","n":1365,"brier":0.211343775,"logloss":0.6104049091,"accuracy":0.652014652,"ece":0.0281702338,"slope":0.9859695985,"slope_lo":0.8409434514,"slope_hi":1.1309957455,"skill":-0.0010771057,"skill_lo":-0.0041290347,"skill_hi":0.0019044129,"dm_p_better_bh":0.9999969419},{"bt_run_id":"nfl_games_v1:7244a0bc8ac6","split":"tune","phase":"pooled","candidate":"B1[C2]","n":1365,"brier":0.2111007584,"logloss":0.6098028637,"accuracy":0.6542124542,"ece":0.0320578048,"slope":1.0093730586,"slope_lo":0.8613687266,"slope_hi":1.1573773905,"skill":7.3997e-05,"skill_lo":-0.0019706872,"skill_hi":0.0021391293,"dm_p_better_bh":0.9999969419},{"bt_run_id":"nfl_games_v1:7244a0bc8ac6","split":"tune","phase":"pooled","candidate":"B1[E1]","n":1365,"brier":0.2111375673,"logloss":0.6099109304,"accuracy":0.6549450549,"ece":0.0284812893,"slope":0.9828195531,"slope_lo":0.8386411899,"slope_hi":1.1269979163,"skill":-0.0001003566,"skill_lo":-0.0027957716,"skill_hi":0.0026180554,"dm_p_better_bh":0.9999969419},{"bt_run_id":"nfl_games_v1:7244a0bc8ac6","split":"tune","phase":"pooled","candidate":"B2[E1]","n":1365,"brier":0.2111943006,"logloss":0.6099268751,"accuracy":0.652014652,"ece":0.0314964542,"slope":1.0622473292,"slope_lo":0.9069030626,"slope_hi":1.2175915959,"skill":-0.0003690865,"skill_lo":-0.0012553822,"skill_hi":0.0004980295,"dm_p_better_bh":0.9999969419},{"bt_run_id":"nfl_games_v1:7244a0bc8ac6","split":"tune","phase":"pooled","candidate":"K[E1]","n":1365,"brier":0.2198266599,"logloss":0.630152458,"accuracy":0.6446886447,"ece":0.0424624411,"slope":0.9233161195,"slope_lo":0.770704329,"slope_hi":1.07592791,"skill":-0.0412581889,"skill_lo":-0.060907596,"skill_hi":-0.0222478165,"dm_p_better_bh":0.9999969419},{"bt_run_id":"nfl_games_v1:7244a0bc8ac6","split":"tune","phase":"REG","candidate":"C0","n":1304,"brier":0.2108107256,"logloss":0.6091312181,"accuracy":0.6541411043,"ece":0.0281459786,"slope":1.0431119952,"slope_lo":0.8877856898,"slope_hi":1.1984383005,"skill":0,"skill_lo":0,"skill_hi":0},{"bt_run_id":"nfl_games_v1:7244a0bc8ac6","split":"tune","phase":"REG","candidate":"C1","n":1304,"brier":0.2222419265,"logloss":0.6356359158,"accuracy":0.6326687117,"ece":0.0234375373,"slope":1.0098085391,"slope_lo":0.8299542675,"slope_hi":1.1896628106,"skill":-0.0542249493,"skill_lo":-0.077366287,"skill_hi":-0.0318515211,"dm_p_better_bh":0.9999957142},{"bt_run_id":"nfl_games_v1:7244a0bc8ac6","split":"tune","phase":"REG","candidate":"C2","n":1304,"brier":0.2196542347,"logloss":0.6289007893,"accuracy":0.6457055215,"ece":0.0344372534,"slope":1.0531941673,"slope_lo":0.8770474718,"slope_hi":1.2293408629,"skill":-0.0419499961,"skill_lo":-0.0634984754,"skill_hi":-0.021210204,"dm_p_better_bh":0.9999957142},{"bt_run_id":"nfl_games_v1:7244a0bc8ac6","split":"tune","phase":"REG","candidate":"E1","n":1304,"brier":0.2194696826,"logloss":0.6289800374,"accuracy":0.6418711656,"ece":0.0384242669,"slope":1.090521101,"slope_lo":0.9067520132,"slope_hi":1.2742901888,"skill":-0.041074556,"skill_lo":-0.0614429515,"skill_hi":-0.0215804795,"dm_p_better_bh":0.9999957142},{"bt_run_id":"nfl_games_v1:7244a0bc8ac6","split":"tune","phase":"REG","candidate":"B1[C1]","n":1304,"brier":0.2110296499,"logloss":0.6098604481,"accuracy":0.6533742331,"ece":0.0294099046,"slope":0.9823242454,"slope_lo":0.8350883823,"slope_hi":1.1295601086,"skill":-0.0010384874,"skill_lo":-0.0041966889,"skill_hi":0.0020603777,"dm_p_better_bh":0.9999957142},{"bt_run_id":"nfl_games_v1:7244a0bc8ac6","split":"tune","phase":"REG","candidate":"B1[C2]","n":1304,"brier":0.2108115275,"logloss":0.6092967722,"accuracy":0.6556748466,"ece":0.0266087236,"slope":1.0056177093,"slope_lo":0.855328553,"slope_hi":1.1559068655,"skill":-3.8039e-06,"skill_lo":-0.0021034083,"skill_hi":0.0020919882,"dm_p_better_bh":0.9999957142},{"bt_run_id":"nfl_games_v1:7244a0bc8ac6","split":"tune","phase":"REG","candidate":"B1[E1]","n":1304,"brier":0.2108326352,"logloss":0.6093810546,"accuracy":0.6564417178,"ece":0.0327643646,"slope":0.9792169352,"slope_lo":0.8328301795,"slope_hi":1.1256036908,"skill":-0.0001039302,"skill_lo":-0.0029356807,"skill_hi":0.002716327,"dm_p_better_bh":0.9999957142},{"bt_run_id":"nfl_games_v1:7244a0bc8ac6","split":"tune","phase":"REG","candidate":"B2[E1]","n":1304,"brier":0.2108935977,"logloss":0.6093834656,"accuracy":0.6533742331,"ece":0.030334932,"slope":1.058152776,"slope_lo":0.900405656,"slope_hi":1.215899896,"skill":-0.0003931116,"skill_lo":-0.001300983,"skill_hi":0.0005295798,"dm_p_better_bh":0.9999957142},{"bt_run_id":"nfl_games_v1:7244a0bc8ac6","split":"tune","phase":"REG","candidate":"K[E1]","n":1304,"brier":0.2197445222,"logloss":0.6300740115,"accuracy":0.6449386503,"ece":0.0456558132,"slope":0.914451526,"slope_lo":0.7601405923,"slope_hi":1.0687624598,"skill":-0.0423782829,"skill_lo":-0.0627058509,"skill_hi":-0.0227025779,"dm_p_better_bh":0.9999957142},{"bt_run_id":"nfl_games_v1:7244a0bc8ac6","split":"tune","phase":"POST","candidate":"C0","n":61,"brier":0.2176503774,"logloss":0.6214391265,"accuracy":0.6229508197,"ece":0.1564007456,"slope":1.5634351277,"slope_lo":0.4478309377,"slope_hi":2.6790393177,"skill":0,"skill_lo":0,"skill_hi":0},{"bt_run_id":"nfl_games_v1:7244a0bc8ac6","split":"tune","phase":"POST","candidate":"C1","n":61,"brier":0.2248491433,"logloss":0.6390475562,"accuracy":0.6229508197,"ece":0.1496761459,"slope":1.6032949948,"slope_lo":0.2345237956,"slope_hi":2.9720661939,"skill":-0.0330749066,"skill_lo":-0.1423819008,"skill_hi":0.0420432209,"dm_p_better_bh":0.7876403254},{"bt_run_id":"nfl_games_v1:7244a0bc8ac6","split":"tune","phase":"POST","candidate":"C2","n":61,"brier":0.2194697316,"logloss":0.6283134164,"accuracy":0.6721311475,"ece":0.1665043236,"slope":1.6917979523,"slope_lo":0.4623540122,"slope_hi":2.9212418924,"skill":-0.0083590675,"skill_lo":-0.0645817389,"skill_hi":0.0472624901,"dm_p_better_bh":0.7876403254},{"bt_run_id":"nfl_games_v1:7244a0bc8ac6","split":"tune","phase":"POST","candidate":"E1","n":61,"brier":0.2209324791,"logloss":0.6310656613,"accuracy":0.6393442623,"ece":0.1943909788,"slope":1.83369611,"slope_lo":0.4447584757,"slope_hi":3.2226337442,"skill":-0.0150796971,"skill_lo":-0.0816642084,"skill_hi":0.0366379612,"dm_p_better_bh":0.7876403254},{"bt_run_id":"nfl_games_v1:7244a0bc8ac6","split":"tune","phase":"POST","candidate":"B1[C1]","n":61,"brier":0.2180588436,"logloss":0.6220438796,"accuracy":0.6229508197,"ece":0.1468800952,"slope":1.4629104839,"slope_lo":0.3976393622,"slope_hi":2.5281816055,"skill":-0.0018767079,"skill_lo":-0.0102277324,"skill_hi":0.0058295655,"dm_p_better_bh":0.7876403254},{"bt_run_id":"nfl_games_v1:7244a0bc8ac6","split":"tune","phase":"POST","candidate":"B1[C2]","n":61,"brier":0.2172836614,"logloss":0.6206216066,"accuracy":0.6229508197,"ece":0.1470199381,"slope":1.4904506364,"slope_lo":0.4166426384,"slope_hi":2.5642586345,"skill":0.0016848855,"skill_lo":-0.0065724584,"skill_hi":0.0102425025,"dm_p_better_bh":0.7876403254},{"bt_run_id":"nfl_games_v1:7244a0bc8ac6","split":"tune","phase":"POST","candidate":"B1[E1]","n":61,"brier":0.2176561155,"logloss":0.6212381111,"accuracy":0.6229508197,"ece":0.1457668,"slope":1.4513508468,"slope_lo":0.3994474219,"slope_hi":2.5032542718,"skill":-2.63637e-05,"skill_lo":-0.0083810302,"skill_hi":0.0088745814,"dm_p_better_bh":0.7876403254},{"bt_run_id":"nfl_games_v1:7244a0bc8ac6","split":"tune","phase":"POST","candidate":"B2[E1]","n":61,"brier":0.2176224395,"logloss":0.6215433669,"accuracy":0.6229508197,"ece":0.1897847323,"slope":1.5913609054,"slope_lo":0.4565052082,"slope_hi":2.7262166027,"skill":0.0001283611,"skill_lo":-0.0029644608,"skill_hi":0.0026096286,"dm_p_better_bh":0.7876403254},{"bt_run_id":"nfl_games_v1:7244a0bc8ac6","split":"tune","phase":"POST","candidate":"K[E1]","n":61,"brier":0.2215825214,"logloss":0.6318294141,"accuracy":0.6393442623,"ece":0.1537252531,"slope":1.5396323731,"slope_lo":0.3601979163,"slope_hi":2.7190668298,"skill":-0.0180663321,"skill_lo":-0.0711463667,"skill_hi":0.0316144779,"dm_p_better_bh":0.7876403254},{"bt_run_id":"nfl_games_v1:7244a0bc8ac6","split":"confirm","phase":"pooled","candidate":"C0","n":570,"brier":0.2098065612,"logloss":0.6080921948,"accuracy":0.6912280702,"ece":0.052663837,"slope":1.1442708571,"slope_lo":0.8821045023,"slope_hi":1.4064372119,"skill":0,"skill_lo":0,"skill_hi":0},{"bt_run_id":"nfl_games_v1:7244a0bc8ac6","split":"confirm","phase":"pooled","candidate":"C1","n":570,"brier":0.2216379595,"logloss":0.6342963126,"accuracy":0.649122807,"ece":0.0478635619,"slope":1.0271693313,"slope_lo":0.7467620961,"slope_hi":1.3075765665,"skill":-0.0563919366,"skill_lo":-0.094